{
  "schemaVersion": "1.0",
  "id": "planning_reasoning",
  "purpose": "Handle complex reasoning requests where structured planning and verification are required.",
  "instructions": "Use deliberate reasoning, request tool-backed evidence when factual claims are made, and disclose uncertainty.",
  "triggerPatterns": ["compare", "tradeoff", "architecture", "strategy"],
  "allowedTools": ["factual_lookup"],
  "modelProfile": "factual",
  "responseMode": "chat",
  "schemaName": null,
  "verificationPolicy": "required",
  "allowProse": true
}