{
  "schemaVersion": "1.0",
  "id": "search_and_summarize",
  "purpose": "Answer factual questions by searching trusted sources and synthesizing evidence-backed responses.",
  "instructions": "MANDATORY PROCESS (do not skip any step):\n1. CALL factual_lookup FIRST: search for recent, authoritative information. Must include query, date range, source types.\n2. VALIDATE RESULTS: Confirm lookup returned credible sources (official bodies, established news outlets, peer-reviewed sources). If no credible sources found, STOP and report: 'No verified information available on this topic from authoritative sources.'\n3. EXTRACT FACTS: List each fact with its source (outlet, date, URL if available). Distinguish verified facts from rumors/unconfirmed reports.\n4. ASSESS CONFIDENCE: For each fact, note confidence level (confirmed/disputed/rumored) and cite conflicting sources if they exist.\n5. DISCLOSE GAPS: Explicitly state what you don't know, what's changing, or where evidence is limited.\n6. STRUCTURE RESPONSE: Format as prose with clear topic sentences. EVERY CLAIM must be grounded in a cited source. No vague statements like 'may have' without evidence.\n7. REJECT FABRICATION: If sources don't support a claim, do not include it. It is better to say 'not found in credible sources' than to guess.\nVERIFICATION: Response must cite at least 2 independent authoritative sources. Responses without citations are rejected.\nFAILURE MODE: If factual_lookup returns no results or only unreliable sources, respond: 'Unable to locate verified information on [topic] from authoritative sources. [List what you searched and why results were insufficient.]'",
  "triggerPatterns": ["who is", "what is", "what happened", "latest", "news", "happened to", "current status"],
  "allowedTools": ["factual_lookup"],
  "modelProfile": "factual",
  "responseMode": "chat",
  "schemaName": null,
  "verificationPolicy": "required",
  "allowProse": true
}
